owner,repo,topics,readme,created_at,updated_at,language,owner,owner_type,watchers_count,stargazers_count,forks_count,commits_count,default_branch,contributors,contributors_count,releases_count,tags_count,open_issues_count,closed_issues_count,open_pr_count,closed_pr_count
ibm-watson-embedded-business-assistant,eba-example-agents,ai#anomalydetection#assistant#autonomic-computing#bpm#chatbot#reasoning,This is not a chatbot This is EBA Business Assistant Digital Twin Business Process AI top down RPA BPU BPA whatever you call it by engineers need the best techniques in order to bring valuable AI to their customers EBA presents a unique and proven model based on modern patent pending approaches to machine reasoning The Embedded Business AI EBA framework is an open hybrid multi cloud deployable omni channel enterprise class digital AI framework used by developers to enable advanced domain specific process automation RPA use cases for business users Unlike other dialog management systems that use rule based reasoning and predicate logic with EBA you describe your business domain to the machine in a simple consistent complete and straightforward way Dialog whether human machine or machine machine interaction are simply inputs to and outputs from the reasoning core In other words this is not a chatbot Watson Marketing Assistant powered by EBA assets img ebawmascreenshot png Watson Marketing Assistant powered by EBA assets img ebawmascreenshot png What can you do with EBA In the video below see how IBM used EBA to create an omni present digital twin for marketing professionals that supports its human counterpart wherever she may conduct business IBM Watson Marketing https img youtube com vi KlavNwVEEuU 0 jpg https www youtube com watch v KlavNwVEEuU We also have sample agents for other domains like Supply Chain within the dev lab https eba ibm com assistant lab for you to dig into Contributing This is the public home of the Embedded Business AI framework EBA Please log issues https github com ibm watson embedded business assistant eba example agents issues you encounter with EBA and if you have a contribution please submit a pull request https github com ibm watson embedded business assistant eba example agents pulls Usage Developers feel free to explore EBA build your AI experiences and share with your work colleagues and friends When it comes time for you to release to production please contact us https github com osidorkin and well help get you over the line Services include developer integration support service level agreements and access to the latest AI contributions from our staff and partners License EBA is a framework constructed and operated by the EBA platform engineering team at IBM This repository hosts documentation and sample configurations that work with the EBA core platform This content is licensed under the Apache 2 0 license Full license text is available in LICENSE LICENSE,2018-07-09T18:03:48Z,2019-12-10T19:28:38Z,CSS,ibm-watson-embedded-business-assistant,Organization,8,7,21,822,master,osidorkin#kevingrozav#sbatin#meaganjohnson#arsu77#elahexyz#carstenmichel#Conner1341#louisroehrs#abbasally5#ChristopherNoessel-IBM,11,0,0,3,3,1,16
MikeMpapa,CogBeacon-MultiModal_Dataset_for_Cognitive_Fatigue,n/a,Paper Citation Papakostas Michalis Akilesh Rajavenkatanarayanan and Fillia Makedon CogBeacon A Multi Modal Dataset and Data Collection Platform for Modeling Cognitive Fatigue Technologies 7 2 2019 46 articlepapakostas2019cogbeacon title CogBeacon A Multi Modal Dataset and Data Collection Platform for Modeling Cognitive Fatigue author Papakostas Michalis and Rajavenkatanarayanan Akilesh and Makedon Fillia journal Technologies volume 7 number 2 pages 46 year 2019 publisher Multidisciplinary Digital Publishing Institute CogBeacon A Multi Modal Dataset for Modeling Cognitive Fatigue CogBeacon is a multi modal dataset designed to target the effects of cognitive fatigue in human performance The dataset consists of 76 sessions collected from 19 male and female users performing different versions of the Wisconsin Card Sorting Test WCST a popular cognitive test in experimental and clinical psychology designed to assess cognitive flexibility reasoning and specific aspects of cognitive functioning During each session we record and fully annotate user s EEG functionality facial keypoints real time self reports on cognitive fatigue as well as detailed information of the performance metrics achieved during the cognitive task success rate response time number of errors etc Along with the dataset we provide a baseline Machine Learning analysis towards predicting cognitive fatigue and our multi modal implementation of the WCST to allow other researches expand or modify the functionalities of the CogBeacon data collection framework To our knowledge this is the first multi modal dataset specifically designed to assess cognitive fatigue CogBeacon Data Collection Platform can be found The WCST Interface https github com MikeMpapa CogBeacon WCSTinterface Dataset Details As mentioned above the dataset consists of 4 folders EEG facekeypoints fatigueselfreport and userperformance Below we explain the contents of each folder and the way the data is organized Please refer to our paper CogBeacon A Multi Modal Dataset and Data Collection Platform for Modeling Cognitive Fatigue insert link to publication for more details about the dataset and data collection methodology 1 EEG Data Filename structure There are 76 sessions and data from each session is stored in a separate folder This folder is named user For example the folder name user0vm implies the folder belongs to user with ID 0 using the visual stimuli and that data were collected by a modified version of the WCST task V1 or V2 If the userid is a single integer and the game mode is characterised by the letter m it means that data were recorder using the V1 WCST version If userid is followed by the letter b and the game mode is characterised as m it means that the folder contains data captured using V2 version of the WCST Finally if game mode is characterised by the letter o it means that data collection was based on replicating the rules of the original WCST Bellow are explained the values of the different flags in detail UserID if ID data were collected in the first day of data collection and IF GameMode m WCST V1 if IDb data were collected in the second day of data collection and IF GameMode m WCST V2 StimuliType v visual t textual a auditory GameMode o simulation of the original WCST test m modified version of the WCST Each of these folders consists of individual files collected during each round ie a single answer provided by the user The file name encoding is as follows For example file 317 containes the data captured during the 17th round of the game which was the 3rd round under the same decision rule The EEG Data was recorded using the Muse EEG headset https choosemuse com The headset has four electrodes two over the prefrontal lobe and two behind the ears The data set consists of Raw EEG at a sampling frequency of 220 Hz Absolute Frequency Bands A gamma 32 100 Hz gamma beta 13 32 Hz beta alpha 8 13 Hz alpha theta 4 8 Hz theta and delta 0 5 4Hz delta at sampling frequency of 10 Hz The absolute band power for a given frequency range is the logarithm of the sum of the Power Spectral Density of the EEG data over that frequency range where flow and fhigh are the minimum and maximum frequencies of frequency band x and G is the FFT of the raw EEG signal g Relative Frequency Bands R gamma beta alpha theta and delta at sampling frequency of 10 Hz The relative band powers are calculated by dividing the absolute linear scale power in one band over the sum of the absolute linear scale powers in all bands where x is one of the five frequency bands Session Score for each Frequency band S A value computed by comparing the current value f a band power to its history in sampling frequency of 10 Hz This value is mapped to a score etween 0 and 1 using a linear function that returns 0 if the current value is equal to or below the 10th percentile of the distribution of band powers and returns 1 if its equal to or above the 90th percentile Linear scoring between 0 and 1 is done for any value between these two percentiles Signal Quality Indicator An integer value from 1 optimal quality to 4 very bad quality 2 Facial Keypoints To capture behavioral changes during the task we also recorded variations in the movement of the face capturing a set of 68 facial keypoints and four corners for bounding box with a webcam placed on top of the screen at a frame rate of 2 FPS To identify facial keypoints we deployed the method presented by Kazemi et al http openaccess thecvf com contentcvpr2014 papers KazemiOneMillisecondFace2014CVPRpaper pdf that uses a Regression Tree approach and can be applied in a real time Filename structure This data can be found in a folder named facekeypoints Similar to the EEG dataset there are 76 sessions and data from each session is stored in a separate folder The name of these folders follow the same naming as explained above The last flag in the filename indicates the frameID Thus each filename has a name structure as The facial keypoints and the corners of the bounding box are stored in a numpy npz For example file named 113 npz indicates that it contains the keypoints captured in the third frame of the session which bellonged in the 1st round of the game which was also the 1st round under the same decision rule 3 Fatigue self report During each session participants were told to report when they were having trouble to keep up with the task by pressing a button placed in front of them The button could be pressed at any time during a game as many times as the participants felt appropriate Filename structure This data can be found in the folder named fatigueselfreport The self reports are stored as csv files for each session and the name of these files follow the same structures as the eeg session folders and facial keypoints session folders Each record in the csv indicates how the total number of times a user has pressed the button at this specific point of the game Each row of the csv corresponds to a game round For example an a value of 3 in row 50 means that in that until the 50th round the user had pressed the button 3 times 4 User Performance For every round of every session the system logs a set of metrics and scores related to user performance with respect to the task For each session user performance metrics are stored as a csv and each file follows he same naming convention as the other type of data with an additional metric at the end of the filename indicating the total score of the user at the end of the game computed by summing the individual user scores at each round The formula for estimating user scores at each round can be found bellow Each record of the csv consists of the following metrics Round Number An integer value indicating the current round Question number An integer value indicating the current question number under a specific rule type Level An integer value indicating the current level of the test It indicates number of possible choices offered by the system 2 3 4 or 5 Score An indicative round based user score computed as Stimuli The type of the correct stimuli color shape or number Stimuli Type The value of the correct stimuli If color green yellow blue red or magenta If shape triangle star cross circle or heart If number one two three four or five Response A binary flag that indicating if user response was correct in a given round Time Users response time at every round in seconds Correct The total number of correct answers NON PER Errors The cumulative number of non perseverative errors until the current round Non perseverative errors are the errors recorded when the user tries to figure out the new rule after a rule change Given that there were three possible decision rules in total based on color or shape or number a user is supposed to figure out the correct rule no later than the third round after a rule change Any error that occurred before the third round is considered as non perseverative error PER Errors The cumulative number of perseverative errors until the current round Perseverative errors are when the user continues to apply the wrong rule despite the informative feedback provided by the system Source code ML analysis The code and the data splited into 10 Folds for cross validation that we used for the ML analysis in our papaer CogBeacon A Multi Modal Dataset and Data Collection Platform for Modeling Cognitive Fatigue can be found HERE https www dropbox com sh 1i49we8usl3bma0 AAC5O2peccM7tzMMiqjVRnZza dl 0 Details about the EEG data codes used in python can be found HERE https github com MikeMpapa CogBeacon MultiModalDatasetforCognitiveFatigue issues 1 Confidentiality Data Sharing Our team has received permission by the Institutional Review Board IRB of the University of Texas at Arlington UTA in order to conduct these experiments and share the attached data CogBeacons protocols ID is 2019 0253 and its title is CogBeacon Towards detecting cognitive fatigue Main contributors of this study are Mr Michalis Papakostas PI michalis papakostas mavs uta edu Mr Akilesh Rajavenkatanarayanan CO PI akilesh rajavenkatanarayanan mavs uta edu and Dr Fillia Makedon Faculty Advisor makedon uta edu For additional information or questions about the confidentiality or data sharing protocol please feel free to contact directly the IRB office at UTA erahelpdesk uta edu or to the project personnel Available in the repo is a copy of the consent form that the participants had to sign Paper Citation Papakostas Michalis Akilesh Rajavenkatanarayanan and Fillia Makedon CogBeacon A Multi Modal Dataset and Data Collection Platform for Modeling Cognitive Fatigue Technologies 7 2 2019 46 articlepapakostas2019cogbeacon title CogBeacon A Multi Modal Dataset and Data Collection Platform for Modeling Cognitive Fatigue author Papakostas Michalis and Rajavenkatanarayanan Akilesh and Makedon Fillia journal Technologies volume 7 number 2 pages 46 year 2019 publisher Multidisciplinary Digital Publishing Institute,2019-02-26T22:35:14Z,2019-11-26T04:00:36Z,n/a,MikeMpapa,User,3,3,2,59,master,akileshrajan#MikeMpapa,2,0,0,0,1,0,0
ducminhkhoi,MAC_Network,n/a,This is the Pytorch Implementation of Compositional Attention Networks for Machine Reasoning https arxiv org abs 1803 03067 1 Download and extract CLEVR dataset from https cs stanford edu people jcjohns clevr https cs stanford edu people jcjohns clevr then put it in folder data 2 Create folder weights to store snapshot of the model while training 3 Read the argparse part in main py for more options and run python main py to get the result of default setting,2018-04-16T16:29:05Z,2019-05-03T07:27:44Z,Python,ducminhkhoi,User,1,2,2,3,master,ducminhkhoi,1,0,0,2,0,0,0
MelechMaglasang,hw3,n/a,404 Not Found,2019-02-22T19:38:36Z,2019-03-02T22:50:12Z,Java,MelechMaglasang,User,0,1,0,17,development,MelechMaglasang,1,0,0,0,0,0,0
StuartCHAN,implementation_for_machine_reading_and_strategique_reasoning,artificial-intelligence#natural-language-processing,The implementation for machine reading and strategique reasoning For a given professional article through machine reading it is required to be able to locate analyze and reason the answers to specific questions in the text The problem covers six types factual questions list type questions definition type questions opinion type questions and text type questions The principle is to let the machine read the above 6 types of questions and generate answers The matching degree of the answers with the standard answers is evaluated using the ROUGE L and BLEU indicators For the usage and the results of data all rights reserved to the organiser This implementation is inspired by Google s QANet https openreview net pdf id B14TlG RW and the blog https medium com minsangkim implementing question answering networks with cnns 5ae5f08e312b Dataset The basic data collection is originally provided by China Electronics Technology Group Corporation No 28 Research Institute exclusively for participants engaged Requirements Python 2 7 NumPy tqdm TensorFlow 1 5 spacy 2 0 9 bottle Usage To preprocess the data run bash preprocess the data python config py mode prepro This procedure of processing is learned from R Net by HKUST KnowComp https github com HKUST KnowComp R Net hyper parameters are stored in config py To debug train test demo run bash python config py mode debug train test demo To evaluate the trained model with the code provided by the organiser run bash python testcommon py data modelname json train modelname answer answer json The default directory for the tensorboard log file is train modelname event,2018-11-17T11:35:06Z,2018-11-18T05:46:34Z,Python,StuartCHAN,User,1,1,0,5,master,StuartCHAN,1,0,0,0,0,0,0
ushagayatri,ushalokala,n/a,404 Not Found,2019-03-13T20:24:14Z,2019-07-18T22:49:38Z,n/a,ushagayatri,User,0,1,0,2,master,ushagayatri,1,0,0,0,0,0,0
vermouth1992,CSCI699ml4know,deep-learning#deep-reinforcement-learning#named-entity-recognition#natural-language-processing#relation-extraction#sentiment-analysis,CSCI699ml4know CSCI 699 Machine Learning for Knowledge Extraction amp Reasoning Spring 2019 Homework,2019-02-02T06:54:57Z,2019-05-05T22:30:23Z,Python,vermouth1992,User,0,1,1,74,master,vermouth1992,1,0,0,0,0,0,0
priyanksharma7,Artificial-Intelligence,n/a,Artificial Intelligence Projects from my COMP3270 course at The University of Hong Kong Topics include intelligent agents search techniques for problem solving knowledge representation logical inference reasoning under uncertainty statistical models and machine learning NOTE Please use Python 3 and not Python 2,2019-02-01T00:48:48Z,2019-02-01T01:24:12Z,Python,priyanksharma7,User,0,1,0,6,master,priyanksharma7#priyanksharma2510,2,0,0,0,0,0,0
bhpfelix,Compositional-Attention-Networks-for-Machine-Reasoning-PyTorch,n/a,CAN PyTorch Work in Progress This is a PyTorch implementation of the Compositional Attention Network architecture introduced in the recent ICLR 2018 paper Drew A Hudson Christopher D Manning Compositional attention networks for machine reasoning International Conference on Learning Representations 2018 https arxiv org abs 1803 03067 This implementation is focused on exploring and re producing the general characteristics of the architecture,2018-03-18T02:14:51Z,2019-11-15T02:28:46Z,Jupyter Notebook,bhpfelix,User,4,18,7,30,master,bhpfelix,1,0,0,2,1,0,0
cosmicBboy,bayesian-reasoning-machine-learning,n/a,bayesian reasoning machine learning Code and notes for Bayesian Reasoning and Machine Learning,2017-10-31T01:55:42Z,2019-12-05T10:05:28Z,Matlab,cosmicBboy,User,1,7,4,2,master,cosmicBboy,1,0,0,0,0,0,0
nie-ine,N3-rule-based_machine-reasoning,n/a,N3 rule based machine reasoning In the NIE INE http www nie ine ch project we develop an infrastructure to enable scholarly edition projects in the Humanities to express their data in an enriched format adhering to the FAIR principles and ensuring long term storage of the data The project runs at the Swiss Universities of Basel Bern Zrich and Geneva until the end of 2020 The essence of the infrastructure is that data stored in e g a MySQL relational database are converted to a different machine readable format i e one that makes the semantics of the data explicit To enable data expression in this new format a series of vocabularies or ontologies https github com nie ine Ontologies are created representing Semantic Web technology https github com nie ine Ontologies wiki 1 Introduction to Semantic Web technology Besides these ontologies rules for machine resoning are developed They are expressed in the Notation 3 language https www w3 org TeamSubmission n3 also using elements of NIE and external ontologies Notation 3 is an assertion and logic language which is a superset of RDF N3 extends the RDF datamodel by adding formulae literals which are graphs themselves variables logical implication and functional predicates as well as providing a textual syntax alternative to RDF XML In this way Turtle is a subset of N3 The general external ontologies for N3 rule declaration are in following namespaces They provide class and property declarations for built ins representing an extensive variety of functionalities These built ins are mentioned in some of the following rule examples N3 rules serve different purposes Note also mentioned in the use case catalogue Implementation of the RDF model theory A set of N3 rules implementating of the RDF model theory https github com josd eye tree master reasoning rpo permits to infer data from data based on the built in logic of the W3C Semantic Web standard languages Examples are rules for the implementation of prefix rdfs prefix owl rdfs subClassOf rdfs subPropertyOf owl TransitiveProperty owl disjointWith owl oneOf owl unionOf owl disjointUnionOf owl propertyChainAxiom A complete reasoning example on transitivity for the is part of property for text and text structures as prosodic entities is given in the repository also involving a series of other RDFS and OWL rules The data and query files are commented Consistency check for user defined restrictions User defined restrictions can be checked upon e g a cardinality restriction for the object value of a certain property of a certain subject class instance Figure 1 shows part of the human class declaration in Turtle with a cardinality restriction of maximum 1 on the property has biological sex IOW a human can only have exactly 1 biological sex i e female male or intersexual see human ontology https github com nie ine Ontologies blob master Nie ontologies Generic ontologies human ontology ttl prefix human human Human rdfs subClassOf a owl Restriction owl onProperty human hasBiologicalSex owl maxCardinality 1 xs nonNegativeInteger Figure 1 Class declaration with a cardinality restriction of maximum 1 A reasoning example on cardinality is given in the repository using 2 external ontologies and an RDF data set on images of the Knora server application https www knora org developed by the DHLab DHL https dhlab philhist unibas ch en home at the University of Basel and the Data and Service Center for humanities DaSCH https dasch swiss Temporal reasoning Generally time indicators are uniformly converted to intervals to calculate with For this process the machine reasoner provides an extensive set of Time and RIF Built ins https raw githubusercontent com josd eye master eye builtins n3 based on W3C standards RIF Datatypes and Built Ins 1 0 https www w3 org TR 2013 REC rif dtb 20130205 using for instance literals typed with e g xs dateTime and xs duration from the namespace Further functionality is provided by the time ontology https raw githubusercontent com nie ine Ontologies master Nie ontologies Generic ontologies time ontology ttl declaring the properties used in N3 rules A temporal reasoning example is given in the repository considering an event without a start or end date with specific example of missing birth or death date Miscellaneous functionalities and calculations Also for this type of N3 rules a large set of built ins https raw githubusercontent com josd eye master eye builtins n3 is available dealing with e g logical and mathematical operators lists and strings For example string manipulation e g parsing using regular expressions is possible with formal expressions offering the advantage of staying in the formal N3 RDF environment until a fully reasoned upon data set or deductive closure is obtained which can be stored in an RDF database and queried with SPARQL or which can be transformed to JSON LD for GUI application The repository contains a reasoning example on sequence numbers or ordinals derived from entity identifiers using following properties declared in the respective ontology prefix math math hasSequenceLiteral math hasSequenceNumeral and a set of rules that can be made as general as possible but very likely only within a certain project considering the numerous possible combinations in creating alphanumeric identifiers Machine Reasoner EYE Euler Yet another proof Engine Development https github com josd eye Download site https sourceforge net projects eulersharp files eulersharp EYE comes with syntax check and intrinsic functionality provided by built ins https github com josd eye blob master eye builtins n3 All other reasoning material has to be input i e OWL ontologies RDF data N3 rules Basic command example for EYE Note the command for the reasoner is written for Unix OS but can be easily converted for Windows OS eye call the machine reasoner one or more options can be used e g nope option for output without a proof traditional option for N3 syntax e g prefix instead of PREFIX local or remote references can be added to assert ontology data or rule graphs rdf data ttl ref to one or more RDF data sets expressed in Turtle syntax ttl subset of N3 ttl can be replaced by n3 owl ontology ttl ref to one or more OWL ontologies expressed in OWL Full or lesser sublanguage using all possible elements of RDF S OWL ontologies rule n3 ref to one or more N3 rules EYE is a stateless reasoner meaning that all inferencing formalisms have to be fed to it output as a pass OR an N3 query pass output deductive closure all the stated and inferred triples except the rules pass all output deductive closure plus rules query output filtered with N3 query output can be written to a file result n3 result file,2017-05-18T08:43:54Z,2019-12-03T00:29:37Z,Shell,nie-ine,Organization,5,2,0,5,master,janCstoffregen#hanscools,2,0,0,0,0,0,0
