owner,repo,topics,readme,created_at,updated_at,language,owner,owner_type,watchers_count,stargazers_count,forks_count,commits_count,default_branch,contributors,contributors_count,releases_count,tags_count,open_issues_count,closed_issues_count,open_pr_count,closed_pr_count
usptact,PrinterNightmare,bayesian-inference#probabilistic-programming,PrinterNightmare Printer Nightmare Belief Network from D Barber Bayesian Reasoning and Machine Learning The demo shows how to 1 Learn model parameters from data issue and component state history 2 Query trained model The model is trained from 15 visits of a repairmen to CheapCo The query infers the probability of Fuse Assembly fault given that Burning smell and Paper Jam is observed no other issues Updated to use open source Infer NET,2017-10-31T21:02:41Z,2018-11-19T08:47:17Z,C#,usptact,User,1,1,0,3,master,usptact,1,0,0,0,0,0,0
louilinn,Artificial_Intelligence_Projects,n/a,This repository contains three projects 1 An AI playing Othello aka Reversi 2 Machine Learning logistic regression induction of decision trees 3 Probabilistic reasoning over time,2017-02-03T15:46:54Z,2018-12-03T13:21:59Z,Jupyter Notebook,louilinn,User,1,1,0,9,master,louilinn#mirrish,2,0,0,0,0,0,0
Lyyoness,CS50-51---Formal-Analysis,n/a,404 Not Found,2018-02-18T10:44:06Z,2018-04-02T13:09:24Z,Jupyter Notebook,Lyyoness,User,0,1,0,1,master,Lyyoness,1,0,0,0,0,0,0
kavashashank,INST728Q-Visual_Analytics,n/a,INST728Q VisualAnalytics The course consists of special topics experimental course on Visual Analytics in Spring 2016 Visual analytics is the use of interactive visual interfaces to facilitate analytical reasoning In essence visual analytics is based on thenot uncontroversialidea that humans and computers working alone are insufficient for the data challenges of today and tomorrow and that effective synthesis of both humans and computational algorithms are needed to create human in the loop systems Thus visual analytics bridges human centered disciplines such as visualization and human computer interaction with computation centered disciplines such as machine learning probabilistic methods and knowledge discovery In this course intended for iSchool graduate students but open to any masters or Ph D student at UMD you will learn how to apply these exciting techniques to practical problems and work on state of the art research projects that could lead to a publication in one of the prestigious IEEE VIS conferences After taking this course students will be able to Understand human aspects such as perception cognition sensemaking critical thinking and the analytical process Understand computational aspects such as data management data transformations knowledge representation probabilistic methods and text analytics etc Synthesize knowledge from fields such as visualization human computer interaction machine learning knowledge discovery and text analytics towards helping people understand data Use existing visual analytics tools to analyze basic datasets,2017-11-04T00:45:02Z,2018-05-02T17:51:38Z,Jupyter Notebook,kavashashank,User,2,1,2,3,master,kavashashank,1,0,0,0,0,0,0
djour,PyBRML,n/a,SOCIS 2013 Proposal Framework construction and application to real world inference problem The goal of this project would be to implement an efficient and object oriented framework for Python version of BRML toolbox BRML toolbox is developed under MATLAB and offered various demos related to Bayesian Reasoning and Machine Learning The toolbox is affiliated to a recent well designed book by David Barber Reader from Computer Science Department in University College London UCL The significance for our PyBRML work can be emphasized in two ways Bayesian reasoning and probabilistic graphical model is a unified framework for building expert system in order to solve real world problems Currently no actively developing toolbox for bayesian reasoning and probabilistic graphical model under Python exists Our PyBRML would benefits both the book readers engineers and researchers who prefer Python as well The BRML toolbox offered algorithms for various topics such as Bayesian reasoning machine learning dynamic systems and approximate inference etc The current framework in BRML is summarized below https github com pythonroar PyBRML blob master proposal datastructure png In SOCIS 2013 most importantly we will focus on the Bayesian reasoning and probabilistic graphical model section since it provides probabilistic modeling which is fundamental for probabilistic machine learning and dynamical models and further approximate inference Roadmap The First Step of this project is to create a framework for BRML toolbox in Python corresponding to MATLAB version On the Bayesian reasoning and probabilistic graphical model part there are about 10 standalone functions for graph theory 30 for potential manipulation and 20 for inference Thanks to the demos ie demoClouseau demoBurglar demoMRFclean demoMostProbablePath demoShortestPath demoSumprod demoMaxprod demoBucketElim etc offered by BRMLtoolbox we will conduct our implementation based on the demos one by one Finally make the inference algorithms such as factor graph and junction tree accessible for solving problems Further Steps of the project would then consists two directions Develop visualization library for Bayesian reasoning and probabilistic graphical model based on matplotlib library corresponding to miscellaneous functions in BRML toolbox Follow the AAAI00 paper on Bayesian Fault Detection and Diagnosis in Dynamic System make a throughout tutorial on solving real world problems such as engine monitoring and diagnosis Basic Requirements Basic background in machine learning and probabilistic graphical model Former experience with both MATLAB and Python Familiar with basic software engineering techniques such as version control and doctest References The BRML Matlab package manual http web4 cs ucl ac uk staff D Barber textbook brmlpackage pdf Engine Diagnosis paper U Lerner R Parr D Koller and G Biswas Bayesian Fault Detection and Diagnosis in Dynamic Systems In Proceedings of the Seventeenth National Conference on Artificial Intelligence AIII 00 pages 531 537 2000 NASA funding research on diagnostics http ti arc nasa gov tech dash diagnostics and prognostics PyBRML Toolbox PyBRML is a Python version of BRML toolbox for Bayesian Reasoning and Machine Learning Thanks to Dr David Barber s book Bayesian Reasoning and Machine Learning and his original design of the toolbox as an accompanying code for the book Book Bayesian Reasoning and Machine Learning http web4 cs ucl ac uk staff D Barber textbook jacket gif BOOKbarberBRML2012 author Barber D title Bayesian Reasoning and Machine Learning publisher Cambridge University Press year 2012 website for the book http www cs ucl ac uk staff d barber brml Motivation from David The BRMLtoolbox is provided to help readers see how mathematical models translate into actual MAT LAB code There are a large number of demos that a lecturer may wish to use or adapt to help illustrate the material In addition many of the exercises make use of the code helping the reader gain confidence in the concepts and their application Along with complete routines for many Machine Learning methods the philosophy is to provide low level routines whose composition intuitively follows the mathematical description of the algorithm In this way students may easily match the mathematics with the corresponding algorithmic implementation History Former MATLAB implementation of BRML Toolbox include Object Oriented Version OO Older non OO Check these two version from Dr David Barber s Homepage http web4 cs ucl ac uk staff D Barber pmwiki pmwiki php n Brml Software Contribution The source code is hosted on GitHub and comments suggestions and contributions are welcomed If you use BRML toolbox in your work please cite the reference book License The Python version of BRML toolbox library is available under a GNU license Bundled dependencies Numpy matplotlib Documentation Under construction Community Under construction Reference BOOKbarberBRML2012 author Barber D title Bayesian Reasoning and Machine Learning publisher Cambridge University Press year 2012,2013-06-09T07:51:51Z,2019-12-10T12:44:45Z,Python,djour,User,18,142,41,37,master,djour#MingjunZhou,2,0,0,0,0,0,1
Edderic,BRML-non-OOP,n/a,Please run setup m help Contents displays list of the files There are bugs in the Matlab JIT compiler that may prevent the code working correctly Setup m will turn off the JIT compiler if it detects a bug Setup also adds the graphlayout package from A T Cemgil to the path See LICENSE txt for the license David Barber davidobarber gmail com Department of Computer Science University Collge London November 2008,2015-08-06T23:17:35Z,2019-11-05T11:26:12Z,Matlab,Edderic,User,1,14,5,63,master,Edderic,1,0,0,0,0,0,0
taheris,BRML.jl,n/a,Getting started A working installation of Julia version 0 2 or greater is required which can be downloaded from here http julialang org downloads As NumPy and SciPy from Python are also dependencies a working Python installation along with these libraries are required If these are not yet available the easiest way to get them is to install the Anaconda software which can be downloaded here http www continuum io downloads or they can be installed manually otherwise To start the Julia REPL run the julia binary from a console julia A fresh approach to technical computing Documentation http docs julialang org Type help to list help topics Version 0 2 0 2643 rbab3d1e3d Commit bab3d1e3d 2013 07 15 23 12 09 x8664 unknown linux gnu julia To get the latest list of Julia packages run the Pkg update command julia Pkg update As the toolbox is still in development this package and its dependencies will need to be retrieved manually from this repository To do so change directory to the Julia package directory at the command line This will be located at julia for Linux and OS X or APPDATA julia packages for Windows by default From the package directory issue the following command git clone https github com taheris BRML jl git From the Julia REPL issue another Pkg update command from to retrieve the toolbox dependencies After this issue the following command to import the package julia using BRML Following that command the BRML package has now been imported into the current Julia environment and is ready to use In future Julia sessions only this command needs to be issued to make the BRML toolbox available,2013-09-02T16:29:36Z,2019-07-25T20:05:38Z,Matlab,taheris,User,2,12,4,3,master,taheris#Edderic,2,0,0,0,1,0,1
codenameyau,inference-engine,n/a,inference engine Reasoning machine built with node Running the demo 1 Clone this repo 2 Run npm install 3 Run node app main js Sample demo Welcome to the inference engine demo Type help for help all dogs are mammals Okay all cats are mammals Okay all mammals are hairy animals Okay all hairy animals are animals Okay all birds are animals Okay are all dogs animals true are all dogs cats false are all birds cats false are all animals birds false,2014-12-10T21:59:37Z,2017-10-20T00:25:28Z,JavaScript,codenameyau,User,1,10,1,35,master,codenameyau,1,0,0,0,0,0,0
MyCSHome,Machine-Learning-Implementations,n/a,code for Imperial College C395 class implemented decision tree neural network case based reasoning and statistical test,2013-02-28T10:31:53Z,2014-07-13T16:18:11Z,Matlab,MyCSHome,User,2,3,6,4,master,MyCSHome,1,0,0,0,0,0,0
iliasfotopoulos,machine-translator,n/a,Machine Translator Machine translation of numbers in words from greek to english and vice versa using Prolog for NTUA http www ece ntua gr en Knowledge Representation and Reasoning Course Assignment summary Goal of the assignment is to translate numbers written in words from a natural language to another For example a hundred ninety three six hundred twelve cent quatre vingt treize six cents douze ein Hundert drei und neunzig sechs Hundert zwoelf Natural Language Parser Design a natural language machine translator that takes as input a number from zero to nine hundred and ninety nine in a Language A and translates it to an other Language B and vice versa Examples a hundred ein Hundert treize quatorze quinze thirteen fourteen fifteen quatre vingt quatre vingt dix six hundred Programming Enviroment Usage of DCG definite clause grammar using GULP 3 1 http www cs toronto edu dianaz 2501 Parser gulp3mod pl Prolog extension for Unification Based Grammar,2014-10-12T07:48:39Z,2014-12-18T20:27:49Z,Prolog,iliasfotopoulos,User,1,1,0,19,master,iliasfotopoulos,1,0,0,0,0,0,0
